ontology	label	description	url	homepage_url	ols_url	ontology_iri	version_iri	last_loaded
psdo	Performance Summary Display Ontology	"Performance Summary Display Ontology (PSDO) is an application ontology about motivating information in performance summaries and the visual and textual entities that are used to communicate about performance. Motivating information includes performance comparisons and changes that motivate improvement or sustainment, such as improvement towards a goal, loss of high performer status, or the presence of a performance gap. Visual and textual entities include charts, tables, and graphs that display performance information. PSDO's domain focus is healthcare organizations that use clinical quality dashboards and feedback interventions for healthcare professionals and teams. Performance information is commonly about the quality of care and health outcomes that have been derived from clinical data using performance measures (aka metrics, process indicators, quality measures, etc). PSDO uses Basic Formal Ontology as its upper level ontology. This work is supported by the NIH, National Library of Medicine (1K01LM012528-01, 1R01LM013894-01).

Landis-Lewis Z, Stansbury C, Rincón J, Gross C. Performance Summary Display Ontology: Feedback intervention content, delivery, and interpreted information. International Conference on Biomedical Ontology 2022 (ICBO 2022). https://icbo-conference.github.io/icbo2022/papers/ICBO-2022_paper_2172.pdf"	https://github.com/Display-Lab/psdo	https://github.com/Display-Lab/psdo	https://www.ebi.ac.uk/ols4/ontologies/psdo	psdo	http://purl.obolibrary.org/obo/2022-02-23/psdo.owl	2026-03-01T05:04:08.327141065
pso	Plant Stress Ontology	The Plant Stress Ontology describes biotic and abiotic stresses that a plant may encounter.	https://github.com/Planteome/plant-stress-ontology	https://github.com/Planteome/plant-stress-ontology	https://www.ebi.ac.uk/ols4/ontologies/pso	pso	http://purl.obolibrary.org/obo/pso/releases/2026-01-08/pso.owl	2026-03-01T05:04:09.056843428
pw	Pathway ontology	A controlled vocabulary for annotating gene products to pathways.	http://rgd.mcw.edu/rgdweb/ontology/search.html	http://rgd.mcw.edu/rgdweb/ontology/search.html	https://www.ebi.ac.uk/ols4/ontologies/pw	pw	http://purl.obolibrary.org/obo/pw/7.97/pw.owl	2026-03-01T05:04:10.210201510
rbo	Radiation Biology Ontology	RBO is an ontology for the effects of radiation on biota in terrestrial and space environments.	https://github.com/Radiobiology-Informatics-Consortium/RBO	https://github.com/Radiobiology-Informatics-Consortium/RBO	https://www.ebi.ac.uk/ols4/ontologies/rbo	rbo	http://purl.obolibrary.org/obo/rbo/releases/2026-01-15/rbo.owl	2026-03-01T05:04:12.399070476
rdfs	The RDF Schema vocabulary (RDFS)		https://www.ebi.ac.uk/ols4/ontologies/rdfs		https://www.ebi.ac.uk/ols4/ontologies/rdfs	rdfs		2026-03-01T05:17:01.658687138
reproduceme	REPRODUCE-ME Ontology	The REPRODUCE-ME ontology is an extension of the PROV-O and the P-Plan ontology to describe a complete path of a scientific experiment. It expresses the REPRODUCE-ME Data Model using the OWL2 Web Ontology Language (OWL2). It provides a set of classes and properties to represent a scientific experiment including its computational and non-computational steps to track the provenance of results. It describes a complete path of a scientific experiment considering the use-case of biological imaging and microscopy experiments, computational experiments, including Jupyter notebooks and scripts. It describes an experiment and its data, agents, activities, plans, steps, variables, instruments, materials, and settings required for its reproducibility.	https://w3id.org/reproduceme/research	https://w3id.org/reproduceme/research	https://www.ebi.ac.uk/ols4/ontologies/reproduceme	reproduceme		2026-03-01T05:23:37.631872387
reto	Regulation of Transcription Ontology	Regulation of Transcription	http://www.semantic-systems-biology.org/apo	http://www.semantic-systems-biology.org/apo	https://www.ebi.ac.uk/ols4/ontologies/reto	reto		2026-03-01T05:21:04.138654809
rexo	Regulation of Gene Expression Ontology	Regulation of Gene Expression	http://www.semantic-systems-biology.org/apo	http://www.semantic-systems-biology.org/apo	https://www.ebi.ac.uk/ols4/ontologies/rexo	rexo		2026-03-01T05:20:32.315068779
ro	Relation Ontology	Relationship types shared across multiple ontologies	https://oborel.github.io/	https://oborel.github.io/	https://www.ebi.ac.uk/ols4/ontologies/ro	ro	http://purl.obolibrary.org/obo/ro/releases/2025-12-17/ro.owl	2026-03-01T05:04:15.481762965
ror	Research Organization Registry	"ROR (Research Organization Registry) is a global, community-led registry
of open persistent identifiers for research organizations. ROR is jointly
operated by California Digital Library, Crossref, and Datacite."	https://ror.org	https://ror.org	https://www.ebi.ac.uk/ols4/ontologies/ror	ror	https://w3id.org/biopragmatics/resources/ror/2.0/ror.ofn	2026-03-01T05:27:29.048697614
rs	Rat Strain Ontology	Ontology of rat strains	http://rgd.mcw.edu/rgdweb/search/strains.html	http://rgd.mcw.edu/rgdweb/search/strains.html	https://www.ebi.ac.uk/ols4/ontologies/rs	rs	http://purl.obolibrary.org/obo/rs/6.270/rs.owl	2026-03-01T05:04:15.939130994
rxno	RXNO	RXNO is the name reaction ontology. It contains more than 500 classes representing organic reactions such as the Diels–Alder cyclization.	https://github.com/rsc-ontologies/rxno	https://github.com/rsc-ontologies/rxno	https://www.ebi.ac.uk/ols4/ontologies/rxno	rxno	http://purl.obolibrary.org/obo/rxno/releases/2021-12-16/rxno.owl	2026-03-01T05:04:16.739967834
sbo	Systems Biology Ontology	Terms commonly used in Systems Biology, and in particular in computational modeling.	http://www.ebi.ac.uk/sbo/	http://www.ebi.ac.uk/sbo/	https://www.ebi.ac.uk/ols4/ontologies/sbo	sbo		2026-03-01T05:09:11.918623100
scdo	Sickle Cell Disease Ontology	An ontology for the standardization of terminology and integration of knowledge about Sickle Cell Disease.	https://scdontology.h3abionet.org/	https://scdontology.h3abionet.org/	https://www.ebi.ac.uk/ols4/ontologies/scdo	scdo	http://purl.obolibrary.org/obo/scdo/releases/2021-04-15/scdo.owl	2026-03-01T05:09:12.229073269
schemaorg_http	schemaorg_http		https://www.ebi.ac.uk/ols4/ontologies/schemaorg_http		https://www.ebi.ac.uk/ols4/ontologies/schemaorg_http	schemaorg_http		2026-03-01T05:17:02.386152693
schemaorg_https	schemaorg_https		https://www.ebi.ac.uk/ols4/ontologies/schemaorg_https		https://www.ebi.ac.uk/ols4/ontologies/schemaorg_https	schemaorg_https		2026-03-01T05:17:02.807208202
semapv	Semantic Mapping Vocabulary	The Semantic Mapping Vocabulary (SEMAPV) captures concepts and relations related to semantic matching, including types of matching (e.g. lexical, manually curated), preprocessing methods and specialised mapping relations.	https://mapping-commons.github.io/semantic-mapping-vocabulary/	https://mapping-commons.github.io/semantic-mapping-vocabulary/	https://www.ebi.ac.uk/ols4/ontologies/semapv	semapv	http://w3id.org/semapv/vocab/releases/2025-01-06/semapv.owl	2026-03-01T05:11:06.875184190
sepio	Ontology for Scientific Evidence and Provenance Information	An ontology for representing the provenance of scientific claims and the evidence that supports them.	https://github.com/monarch-initiative/SEPIO-ontology	https://github.com/monarch-initiative/SEPIO-ontology	https://www.ebi.ac.uk/ols4/ontologies/sepio	sepio	http://purl.obolibrary.org/obo/sepio/releases/2023-06-13/sepio.owl	2026-03-01T05:04:16.969228992
shareloc	ShareLoc	ShareLoc defines terms to annotate data sets from single molecule localization microscopy, including but not limited to: imaging technique, biological structures or molecules of interest, cell types, experimental condition, labeling method, fixation protocol, etc.	https://www.ebi.ac.uk/ols4/ontologies/shareloc		https://www.ebi.ac.uk/ols4/ontologies/shareloc	shareloc		2026-03-01T05:25:59.150133357
sibo	Social Insect Behavior Ontology	Social Behavior in insects	https://github.com/obophenotype/sibo	https://github.com/obophenotype/sibo	https://www.ebi.ac.uk/ols4/ontologies/sibo	sibo		2026-03-01T05:09:13.562142855
sio	Semanticscience Integrated Ontology	The Semanticscience Integrated Ontology (SIO) provides a simple, integrated ontology of types and relations for rich description of objects, processes and their attributes.	https://github.com/micheldumontier/semanticscience	https://github.com/micheldumontier/semanticscience	https://www.ebi.ac.uk/ols4/ontologies/sio	sio	http://semanticscience.org/ontology/sio/v1.59/sio-release.owl	2026-03-01T05:23:16.446918137
skos	skos		https://www.ebi.ac.uk/ols4/ontologies/skos		https://www.ebi.ac.uk/ols4/ontologies/skos	skos		2026-03-01T05:17:02.032651034
slm	SwissLipids	SwissLipids is a curated resource that provides information about known lipids, including lipid structure, metabolism, interactions, and subcellular and tissue localization. Information is curated from peer-reviewed literature and referenced using established ontologies, and provided with full provenance and evidence codes for curated assertions.	https://www.ebi.ac.uk/ols4/ontologies/slm		https://www.ebi.ac.uk/ols4/ontologies/slm	slm		2026-03-01T05:12:36.226707337
slso	Space Life Sciences Ontology	The Space Life Sciences Ontology is an application ontology and is intended to support the operation of NASA's Life Sciences Data Archive and other systems that contain space life science research data.	https://github.com/nasa/LSDAO	https://github.com/nasa/LSDAO	https://www.ebi.ac.uk/ols4/ontologies/slso	slso	http://purl.obolibrary.org/obo/slso/releases/2025-12-11/slso.owl	2026-03-01T05:04:17.425174326
snomed	SNOMED CT (International Edition)	SNOMED CT or SNOMED Clinical Terms is a systematically organized computer processable collection of medical terms providing codes, terms, synonyms and definitions used in clinical documentation and reporting.	https://www.ebi.ac.uk/ols4/ontologies/snomed		https://www.ebi.ac.uk/ols4/ontologies/snomed	snomed	http://snomed.info/sct/900000000000207008/version/20251017	2026-03-01T05:24:14.775719138
so	Sequence types and features ontology	A structured controlled vocabulary for sequence annotation, for the exchange of annotation data and for the description of sequence objects in databases.	http://www.sequenceontology.org/	http://www.sequenceontology.org/	https://www.ebi.ac.uk/ols4/ontologies/so	so	http://purl.obolibrary.org/obo/so/2024-11-18/so.owl	2026-03-01T05:04:18.443158351
spd	Spider Ontology	An ontology for spider comparative biology including anatomical parts (e.g. leg, claw), behavior (e.g. courtship, combing) and products (i.g. silk, web, borrow).	http://research.amnh.org/atol/files/	http://research.amnh.org/atol/files/	https://www.ebi.ac.uk/ols4/ontologies/spd	spd		2026-03-01T05:04:19.092515803
srao	FAIRsharing Subject Ontology (SRAO)	The FAIRsharing Subject Ontology (SRAO) is an application ontology for the categorization of research disciplines across all research domains, from the humanities to the natural sciences. It utilizes multiple external vocabularies.	https://github.com/FAIRsharing/subject-ontology	https://github.com/FAIRsharing/subject-ontology	https://www.ebi.ac.uk/ols4/ontologies/srao	srao	http://www.fairsharing.org/ontology/subject/SRAO/releases/2025-06-01/SRAO.owl	2026-03-01T05:23:21.017975436
stato	STATO: the statistical methods ontology	STATO is the statistical methods ontology. It contains concepts and properties related to statistical methods, probability distributions and other concepts related to statistical analysis, including relationships to study designs and plots.	http://stato-ontology.org/	http://stato-ontology.org/	https://www.ebi.ac.uk/ols4/ontologies/stato	stato	http://purl.obolibrary.org/obo/stato/releases/2025-02-23/stato.owl	2026-03-01T05:04:19.367483481
swo	Software ontology	The Software Ontology (SWO) is a resource for describing software tools, their types, tasks, versions, provenance and associated data. It contains detailed information on licensing and formats as well as software applications themselves, mainly (but not limited) to the bioinformatics community.	https://github.com/allysonlister/swo	https://github.com/allysonlister/swo	https://www.ebi.ac.uk/ols4/ontologies/swo	swo	http://www.ebi.ac.uk/swo/swo/releases/2023-03-05/swo.owl	2026-03-01T05:04:19.777468815
symp	Symptom Ontology	The Symptom Ontology has been developed as a standardized ontology for symptoms of human diseases.	https://github.com/DiseaseOntology/SymptomOntology	https://github.com/DiseaseOntology/SymptomOntology	https://www.ebi.ac.uk/ols4/ontologies/symp	symp	http://purl.obolibrary.org/obo/symp/releases/2024-05-17/symp.owl	2026-03-01T05:04:20.234437148
t4fs	terms4FAIRskills	A terminology for the skills necessary to make data FAIR and to keep it FAIR.	https://github.com/terms4fairskills/FAIRterminology	https://github.com/terms4fairskills/FAIRterminology	https://www.ebi.ac.uk/ols4/ontologies/t4fs	t4fs	http://purl.obolibrary.org/obo/t4fs/releases/2025-02-09/t4fs.owl	2026-03-01T05:04:20.438180524
tads	Tick Anatomy Ontology	The anatomy of the Tick, <i>Families: Ixodidae, Argassidae</i>	https://www.vectorbase.org/ontology-browser	https://www.vectorbase.org/ontology-browser	https://www.ebi.ac.uk/ols4/ontologies/tads	tads	http://purl.obolibrary.org/obo/tads/2015-08-20/tads.owl	2026-03-01T05:10:07.029308678
tao	Teleost Anatomy Ontology	Multispecies fish anatomy ontology. Originally seeded from ZFA, but intended to cover terms relevant to other taxa	http://wiki.phenoscape.org/wiki/Teleost_Anatomy_Ontology	http://wiki.phenoscape.org/wiki/Teleost_Anatomy_Ontology	https://www.ebi.ac.uk/ols4/ontologies/tao	tao	http://purl.obolibrary.org/obo/tao/2012-08-10/tao.owl	2026-03-01T05:10:21.258762032
taxrank	Taxonomic rank vocabulary	A vocabulary of taxonomic ranks (species, family, phylum, etc)	https://github.com/phenoscape/taxrank	https://github.com/phenoscape/taxrank	https://www.ebi.ac.uk/ols4/ontologies/taxrank	taxrank	http://purl.obolibrary.org/obo/taxrank/releases/2025-09-24/taxrank.owl	2026-03-01T05:04:20.572574828
teddy	Terminology for Description of Dynamics	TEDDY is an ontology for dynamical behaviours, observable dynamical phenomena, and control elements of bio-models and biological systems in Systems and Synthetic Biology.	https://www.ebi.ac.uk/ols4/ontologies/teddy		https://www.ebi.ac.uk/ols4/ontologies/teddy	teddy	http://identifiers.org/combine.specifications/teddy.rel-2014-04-24	2026-03-01T05:18:10.808098813
tgma	Mosquito gross anatomy ontology	A structured controlled vocabulary of the anatomy of mosquitoes.	https://www.vectorbase.org/ontology-browser	https://www.vectorbase.org/ontology-browser	https://www.ebi.ac.uk/ols4/ontologies/tgma	tgma	http://purl.obolibrary.org/obo/tgma/releases/2013-06-03/tgma.owl	2026-03-01T05:10:07.566461751
to	Plant Trait Ontology	A controlled vocabulary to describe phenotypic traits in plants.	http://browser.planteome.org/amigo	http://browser.planteome.org/amigo	https://www.ebi.ac.uk/ols4/ontologies/to	to	http://purl.obolibrary.org/obo/to/releases/2026-01-14/to.owl	2026-03-01T05:04:21.361591088
trans	Pathogen Transmission Ontology	The Pathogen Transmission Ontology describes the tranmission methods of human disease pathogens describing how a pathogen is transmitted from one host, reservoir, or source to another host. The pathogen transmission may occur either directly or indirectly and may involve animate vectors or inanimate vehicles.	https://github.com/DiseaseOntology/PathogenTransmissionOntology	https://github.com/DiseaseOntology/PathogenTransmissionOntology	https://www.ebi.ac.uk/ols4/ontologies/trans	trans	http://purl.obolibrary.org/obo/trans/releases/2022-10-10/trans.owl	2026-03-01T05:04:22.738879394
tto	Teleost taxonomy ontology	An ontology covering the taxonomy of teleosts (bony fish)	https://github.com/phenoscape/teleost-taxonomy-ontology	https://github.com/phenoscape/teleost-taxonomy-ontology	https://www.ebi.ac.uk/ols4/ontologies/tto	tto		2026-03-01T05:04:27.058414475
txpo	TOXic Process Ontology (TXPO)	"Elucidating the mechanism of toxicity is crucial in drug safety evaluations. TOXic Process Ontology (TXPO) systematizes a wide variety of terms involving toxicity courses and processes. The first version of TXPO focuses on liver toxicity.

The TXPO contains an is-a hierarchy that is organized into three layers: the top layer contains general terms, mostly derived from the Basic Formal Ontology. The intermediate layer contains biomedical terms in OBO foundry from UBERON, Cell Ontology, NCBI Taxon, ChEBI, Gene Ontology, PATO, OGG, INOH, HINO, NCIT, DOID and Relational ontology (RO). The lower layer contains toxicological terms.

In applied work, we have developed a prototype of TOXPILOT, a TOXic Process InterpretabLe knOwledge sysTem. TOXPILOT provides visualization maps of the toxic course, which facilitates capturing the comprehensive picture for understanding toxicity mechanisms. A prototype of TOXPILOT is available: https://toxpilot.nibiohn.go.jp"	https://toxpilot.nibiohn.go.jp/	https://toxpilot.nibiohn.go.jp/	https://www.ebi.ac.uk/ols4/ontologies/txpo	txpo	http://purl.obolibrary.org/obo/txpo/releases/2022-12-07/txpo.owl	2026-03-01T05:04:34.976551439
uberon	Uber-anatomy ontology	Uberon is an integrated cross-species anatomy ontology representing a variety of entities classified according to traditional anatomical criteria such as structure, function and developmental lineage. The ontology includes comprehensive relationships to taxon-specific anatomical ontologies, allowing integration of functional, phenotype and expression data.	http://uberon.org	http://uberon.org	https://www.ebi.ac.uk/ols4/ontologies/uberon	uberon	http://purl.obolibrary.org/obo/uberon/releases/2025-12-04/uberon.owl	2026-03-01T05:04:42.283606696
unimod	Unimod protein modification database for mass spectrometry	Unimod is a community supported, comprehensive database of protein modifications for mass spectrometry applications. That is, accurate and verifiable values, derived from elemental compositions, for the mass differences introduced by all types of natural and artificial modifications. Other important information includes any mass change, (neutral loss), that occurs during MS/MS analysis, an d site specificity, (which residues are susceptible to modification and any constraints on the position of the modification within the protein or peptide).	http://www.unimod.org/	http://www.unimod.org/	https://www.ebi.ac.uk/ols4/ontologies/unimod	unimod		2026-03-01T05:23:17.732120087
uniprotrdfs	uniprotrdfs		https://www.ebi.ac.uk/ols4/ontologies/uniprotrdfs		https://www.ebi.ac.uk/ols4/ontologies/uniprotrdfs	uniprotrdfs		2026-03-01T05:10:50.025784185
uo	Units of measurement ontology	Metrical units for use in conjunction with PATO	https://github.com/bio-ontology-research-group/unit-ontology	https://github.com/bio-ontology-research-group/unit-ontology	https://www.ebi.ac.uk/ols4/ontologies/uo	uo	http://purl.obolibrary.org/obo/uo/releases/2026-01-16/uo.owl	2026-03-01T05:04:52.352475337
upa	Unipathway	A manually curated resource for the representation and annotation of metabolic pathways	https://github.com/geneontology/unipathway	https://github.com/geneontology/unipathway	https://www.ebi.ac.uk/ols4/ontologies/upa	upa	http://purl.obolibrary.org/obo/upa/releases/2024-03-06/upa.owl	2026-03-01T05:10:09.377822139
upheno	Unified Phenotype Ontology (uPheno)	The uPheno ontology integrates multiple phenotype ontologies into a unified cross-species phenotype ontology.	https://github.com/obophenotype/upheno	https://github.com/obophenotype/upheno	https://www.ebi.ac.uk/ols4/ontologies/upheno	upheno	http://purl.obolibrary.org/obo/upheno/releases/2025-10-12/upheno.owl	2026-03-01T05:05:59.248469017
vbo	Vertebrate Breed Ontology	Vertebrate Breed Ontology is an ontology created to serve as a single computable resource for vertebrate breed names.	https://github.com/monarch-initiative/vertebrate-breed-ontology	https://github.com/monarch-initiative/vertebrate-breed-ontology	https://www.ebi.ac.uk/ols4/ontologies/vbo	vbo	http://purl.obolibrary.org/obo/vbo/releases/2025-11-07/vbo.owl	2026-03-01T05:07:04.226318045
vo	Vaccine Ontology	The Vaccine Ontology (VO) is a community-based biomedical ontology in the domain of vaccine and vaccination. VO aims to standardize vaccine types and annotations, integrate various vaccine data, and support computer-assisted reasoning. The VO supports basic vaccine R&D and clinical vaccine usage. VO is being developed as a community-based ontology with support and collaborations from the vaccine and bio-ontology communities.	https://violinet.org/vaccineontology	https://violinet.org/vaccineontology	https://www.ebi.ac.uk/ols4/ontologies/vo	vo	http://purl.obolibrary.org/obo/vo/releases/2026-01-23/vo.owl	2026-03-01T05:07:13.268691776
vsao	Vertebrate Skeletal Anatomy Ontology-	Vertebrate skeletal anatomy ontology.	https://www.nescent.org/phenoscape/Main_Page	https://www.nescent.org/phenoscape/Main_Page	https://www.ebi.ac.uk/ols4/ontologies/vsao	vsao	http://purl.obolibrary.org/obo/vsao/2012-11-06/vsao.owl	2026-03-01T05:10:22.219999076
vt	The Vertebrate Trait Ontology	The Vertebrate Trait Ontology is a controlled vocabulary for the description of traits (measurable or observable characteristics) pertaining to the morphology, physiology, or development of vertebrate organisms.	https://github.com/AnimalGenome/vertebrate-trait-ontology	https://github.com/AnimalGenome/vertebrate-trait-ontology	https://www.ebi.ac.uk/ols4/ontologies/vt	vt	http://purl.obolibrary.org/obo/vt/releases/2026-02-23/vt.owl	2026-03-01T05:07:17.746158079
vto	Vertebrate Taxonomy Ontology	Comprehensive hierarchy of extinct and extant vertebrate taxa.	https://github.com/phenoscape/vertebrate-taxonomy-ontology	https://github.com/phenoscape/vertebrate-taxonomy-ontology	https://www.ebi.ac.uk/ols4/ontologies/vto	vto	http://purl.obolibrary.org/obo/vto/2020-11-13/vto.owl	2026-03-01T05:07:27.414294644
wbbt	C. elegans Gross Anatomy Ontology	Ontology about the gross anatomy of the C. elegans	https://github.com/obophenotype/c-elegans-gross-anatomy-ontology	https://github.com/obophenotype/c-elegans-gross-anatomy-ontology	https://www.ebi.ac.uk/ols4/ontologies/wbbt	wbbt	http://purl.obolibrary.org/obo/wbbt/releases/2025-08-19/wbbt.owl	2026-03-01T05:07:46.508282049
wbls	C. elegans Development Ontology	Ontology about the development and life stages of the C. elegans	https://github.com/obophenotype/c-elegans-development-ontology	https://github.com/obophenotype/c-elegans-development-ontology	https://www.ebi.ac.uk/ols4/ontologies/wbls	wbls	http://purl.obolibrary.org/obo/wbls/releases/2025-08-12/wbls.owl	2026-03-01T05:07:48.038699474
wbphenotype	C elegans Phenotype Ontology	Ontology about C. elegans and other nematode phenotypes	https://github.com/obophenotype/c-elegans-phenotype-ontology	https://github.com/obophenotype/c-elegans-phenotype-ontology	https://www.ebi.ac.uk/ols4/ontologies/wbphenotype	wbphenotype	http://purl.obolibrary.org/obo/wbphenotype/releases/2025-08-12/wbphenotype.owl	2026-03-01T05:07:49.295145199
wikipathways	WikiPathways	WikiPathways is a database of biological pathways maintained by and for the scientific community.	http://www.wikipathways.org/	http://www.wikipathways.org/	https://www.ebi.ac.uk/ols4/ontologies/wikipathways	wikipathways	https://w3id.org/biopragmatics/resources/wikipathways/20251010/wikipathways.ofn	2026-03-01T05:27:18.167387292
xao	Xenopus Anatomy Ontology	XAO represents the anatomy and development of the African frogs Xenopus laevis and tropicalis.	http://www.xenbase.org/anatomy/xao.do?method=display	http://www.xenbase.org/anatomy/xao.do?method=display	https://www.ebi.ac.uk/ols4/ontologies/xao	xao	http://purl.obolibrary.org/obo/xao/releases/2024-09-03/xao.owl	2026-03-01T05:07:51.675225477
xco	Experimental condition ontology	Conditions under which physiological and morphological measurements are made both in the clinic and in studies involving humans or model organisms.	https://rgd.mcw.edu/rgdweb/ontology/view.html?acc_id=XCO:0000000	https://rgd.mcw.edu/rgdweb/ontology/view.html?acc_id=XCO:0000000	https://www.ebi.ac.uk/ols4/ontologies/xco	xco	http://purl.obolibrary.org/obo/xco/4.227/xco.owl	2026-03-01T05:07:52.372643478
xlmod	HUPO-PSI cross-linking and derivatization reagents controlled vocabulary	A structured controlled vocabulary for cross-linking reagents used with proteomics mass spectrometry.	http://www.psidev.info/groups/controlled-vocabularies	http://www.psidev.info/groups/controlled-vocabularies	https://www.ebi.ac.uk/ols4/ontologies/xlmod	xlmod	http://purl.obolibrary.org/obo/xlmod/1.5.1/xlmod.owl	2026-03-01T05:07:52.961150282
xpo	Xenopus Phenotype Ontology	XPO represents anatomical, cellular, and gene function phenotypes occurring throughout the development of the African frogs Xenopus laevis and tropicalis.	https://github.com/obophenotype/xenopus-phenotype-ontology	https://github.com/obophenotype/xenopus-phenotype-ontology	https://www.ebi.ac.uk/ols4/ontologies/xpo	xpo	http://purl.obolibrary.org/obo/xpo/releases/2025-07-25/xpo.owl	2026-03-01T05:07:58.984557908
zeco	Zebrafish Experimental Conditions Ontology	Ontology of Zebrafish Experimental Conditions	https://github.com/ybradford/zebrafish-experimental-conditions-ontology	https://github.com/ybradford/zebrafish-experimental-conditions-ontology	https://www.ebi.ac.uk/ols4/ontologies/zeco	zeco	http://purl.obolibrary.org/obo/zeco/releases/2022-02-14/zeco.owl	2026-03-01T05:08:08.820627055
zfa	Zebrafish Anatomy Ontology (ZFA)	ZFA description.	https://wiki.zfin.org/display/general/Anatomy+Atlases+and+Resources	https://wiki.zfin.org/display/general/Anatomy+Atlases+and+Resources	https://www.ebi.ac.uk/ols4/ontologies/zfa	zfa	http://purl.obolibrary.org/obo/zfa/releases/2025-09-05/zfa.owl	2026-03-01T05:08:09.334689468
