ontology	label	description	url	homepage_url	ols_url	ontology_iri	version_iri	last_loaded
ddpheno	Dicty Phenotype Ontology (DDPHENO)	A structured controlled vocabulary of phenotypes of the slime-mould Dictyostelium discoideum.	http://dictybase.org/	http://dictybase.org/	https://www.ebi.ac.uk/ols4/ontologies/ddpheno	ddpheno	http://purl.obolibrary.org/obo/ddpheno/releases/2023-08-26/ddpheno.owl	2026-03-01T04:38:45.829936623
dhba	Developing Human Brain Atlas Ontology	An application ontology built by combining ontologised versions of the Allen Institute Developing Human Brain Atlas (DHBA) Structure Graph mapped to Uberon.	https://purl.brain-bican.org/ontology/dhbao	https://purl.brain-bican.org/ontology/dhbao	https://www.ebi.ac.uk/ols4/ontologies/dhba	dhba	https://purl.brain-bican.org/ontology/dhbao/releases/2025-11-13/dhbao.owl	2026-03-01T05:11:01.162663315
dideo	Drug-drug Interaction and Drug-drug Interaction Evidence Ontology	The Potential Drug-drug Interaction and Potential Drug-drug Interaction Evidence Ontology	https://github.com/DIDEO/DIDEO	https://github.com/DIDEO/DIDEO	https://www.ebi.ac.uk/ols4/ontologies/dideo	dideo	http://purl.obolibrary.org/obo/dideo/release/2023-10-16/dideo.owl	2026-03-01T04:38:46.180859889
disdriv	Disease Drivers	Drivers of human diseases including environmental, maternal and social exposures.	https://disease-ontology.org/	https://disease-ontology.org/	https://www.ebi.ac.uk/ols4/ontologies/disdriv	disdriv	http://purl.obolibrary.org/obo/disdriv/releases/2025-03-20/disdriv.owl	2026-03-01T04:38:46.375887255
dmba	Developing Mouse Brain Atlas Ontology	An application ontology built by combining ontologised versions of the Allen Institute Developing Mouse Brain Atlas (DMBA) StructureGraph mapped to Uberon.	https://purl.brain-bican.org/ontology/dmbao	https://purl.brain-bican.org/ontology/dmbao	https://www.ebi.ac.uk/ols4/ontologies/dmba	dmba	https://purl.brain-bican.org/ontology/dmbao/releases/2025-02-10/dmbao.owl	2026-03-01T05:10:50.762534244
doid	Human Disease Ontology	The Disease Ontology has been developed as a standardized ontology for human disease with the purpose of providing the biomedical community with consistent, reusable and sustainable descriptions of human disease terms, phenotype characteristics and related medical vocabulary disease concepts.	https://disease-ontology.org	https://disease-ontology.org	https://www.ebi.ac.uk/ols4/ontologies/doid	doid	http://purl.obolibrary.org/obo/doid/releases/2026-02-28/translations/doid-international.owl	2026-03-01T04:38:48.341330868
dpo	Drosophila Phenotype Ontology	An ontology of commonly encountered and/or high level Drosophila phenotypes.	http://purl.obolibrary.org/obo/fbcv	http://purl.obolibrary.org/obo/fbcv	https://www.ebi.ac.uk/ols4/ontologies/dpo	dpo	http://purl.obolibrary.org/obo/dpo/releases/2026-01-13/dpo.owl	2026-03-01T04:38:52.651650871
dron	The Drug Ontology	An ontology to support comparative effectiveness researchers studying claims data.	https://github.com/ufbmi/dron	https://github.com/ufbmi/dron	https://www.ebi.ac.uk/ols4/ontologies/dron	dron	http://purl.obolibrary.org/obo/dron/releases/2025-12-19/dron.owl	2026-03-01T04:39:37.770890018
duo	Data Use Ontology	DUO is an ontology which represent data use conditions.	https://github.com/EBISPOT/DUO	https://github.com/EBISPOT/DUO	https://www.ebi.ac.uk/ols4/ontologies/duo	duo	http://purl.obolibrary.org/obo/duo/releases/2021-02-23/duo.owl	2026-03-01T04:41:15.003598424
ec	Enzyme Nomenclature	"The Enzyme Nomenclature (also known as the Enzyme Commission Code) is a species-agnostic controlled vocabulary for specific enzymes and an associated hierarchical classification into 7 main categories.

The Enzyme Nomenclature is maintained by the [Nomenclature Committee](https://iubmb.org/about/committees/nomenclature-committee/) of the International Union of Biochemistry and Molecular Biology (IUBMB). A detailed history of the nomenclature since the 1950s can be found [here](https://iubmb.qmul.ac.uk/enzyme/history.html).

There are few notable resources providing access to the Enzyme Nomenclature:

<table class=""table table-striped""><thead><tr><th>Website</th><th>Homepage</td><th>Notes</td></tr></thead><tbody><tr><td>ExplorEnz</td><td><a href=""https://www.enzyme-database.org"">https://www.enzyme-database.org</a></td><td>This is the resource officially recommended by IUBMB</td></tr><tr><td>IUBMB (via by Queen Mary)</td><td><a href=""https://iubmb.qmul.ac.uk/enzyme"">https://iubmb.qmul.ac.uk/enzyme</a></td><td>This is a web-based version of the <a href=""https://archive.org/details/enzymenomenclatu0000inte_d6c2"">1992 publication</a>.</td></tr><tr><td>IntEnz</td><td><a href=""https://www.ebi.ac.uk/intenz"">https://www.ebi.ac.uk/intenz</a></td><td>Shutdown in 2024</td></tr><tr><td>ExPaSy</td><td><a href=""https://enzyme.expasy.org"">https://enzyme.expasy.org</a></td></tr><tr><td>EnzymePortal</td><td><a href=""https://www.ebi.ac.uk/enzymeportal"">https://www.ebi.ac.uk/enzymeportal</a></td><td></td></tr></tbody></table> Licensed under CC-BY-4.0."	https://www.enzyme-database.org/	https://www.enzyme-database.org/	https://www.ebi.ac.uk/ols4/ontologies/ec	ec	https://w3id.org/biopragmatics/resources/ec/2025-04-09/ec.ofn	2026-03-01T05:27:48.444685212
ecao	Echinoderm Anatomy and Development Ontology	None	https://github.com/echinoderm-ontology/ecao_ontology	https://github.com/echinoderm-ontology/ecao_ontology	https://www.ebi.ac.uk/ols4/ontologies/ecao	ecao	http://purl.obolibrary.org/obo/ecao/releases/2025-05-15/ecao.owl	2026-03-01T04:41:16.544743156
eco	Evidence & Conclusion Ontology (ECO)	The Evidence & Conclusion Ontology (ECO) describes types of scientific evidence within the biological research domain that arise from laboratory experiments, computational methods, literature curation, or other means.	https://www.evidenceontology.org	https://www.evidenceontology.org	https://www.ebi.ac.uk/ols4/ontologies/eco	eco	http://purl.obolibrary.org/obo/eco/releases/2026-01-15/eco.owl	2026-03-01T04:41:19.300853412
ecocore	An ontology of core ecological entities	Ecocore is a community ontology for the concise and controlled description of ecological traits of organisms.	https://github.com/EcologicalSemantics/ecocore	https://github.com/EcologicalSemantics/ecocore	https://www.ebi.ac.uk/ols4/ontologies/ecocore	ecocore	http://purl.obolibrary.org/obo/ecocore/releases/2022-03-09/ecocore.owl	2026-03-01T04:41:21.207133475
ecto	Environment Exposure Ontology	ECTO describes exposures to experimental treatments of plants and model organisms (e.g. exposures to modification of diet, lighting levels, temperature); exposures of humans or any other organisms to stressors through a variety of routes, for purposes of public health, environmental monitoring etc, stimuli, natural and experimental, any kind of environmental condition or change in condition that can be experienced by an organism or population of organisms on earth. The scope is very general and can include for example plant treatment regimens, as well as human clinical exposures (although these may better be handled by a more specialized ontology).	https://github.com/EnvironmentOntology/environmental-exposure-ontology	https://github.com/EnvironmentOntology/environmental-exposure-ontology	https://www.ebi.ac.uk/ols4/ontologies/ecto	ecto	http://purl.obolibrary.org/obo/ecto/releases/2026-02-17/ecto.owl	2026-03-01T04:41:25.419141417
edam	EDAM - The ontology of data analysis and management	EDAM is a domain ontology of data analysis and data management in bio- and other sciences, and science-based applications. It comprises concepts related to analysis, modelling, optimisation, and data life cycle. Targetting usability by diverse users, the structure of EDAM is relatively simple, divided into 4 main sections: Topic, Operation, Data (incl. Identifier), and Format.	http://edamontology.org	http://edamontology.org	https://www.ebi.ac.uk/ols4/ontologies/edam	edam	http://edamontology.org/1.25-20251112T1620Z-unstable(1.26)	2026-03-01T05:18:11.090537363
efo	Experimental Factor Ontology	The Experimental Factor Ontology (EFO) provides a systematic description of many experimental variables available in EBI databases, and for projects such as the NHGRI-EBI GWAS catalog. It combines parts of several biological ontologies, such as UBERON anatomy, ChEBI chemical compounds, Cell Ontology and the Monarch Disease Ontology (MONDO). The scope of EFO is to support the annotation, analysis and visualization of data handled by many groups at the EBI and as the core ontology for Open Targets.	http://www.ebi.ac.uk/efo	http://www.ebi.ac.uk/efo	https://www.ebi.ac.uk/ols4/ontologies/efo	efo	http://www.ebi.ac.uk/efo/releases/v3.87.0/efo.owl	2026-03-01T05:17:25.615948191
ehdaa2	Human developmental anatomy, abstract	A structured controlled vocabulary of stage-specific anatomical structures of the developing human.	https://github.com/obophenotype/human-developmental-anatomy-ontology	https://github.com/obophenotype/human-developmental-anatomy-ontology	https://www.ebi.ac.uk/ols4/ontologies/ehdaa2	ehdaa2	http://purl.obolibrary.org/obo/ehdaa2/releases/2024-01-11/ehdaa2.owl	2026-03-01T05:09:23.686317714
emap	Mouse gross anatomy and development, timed	A structured controlled vocabulary of stage-specific anatomical structures of the mouse (Mus).	http://emouseatlas.org	http://emouseatlas.org	https://www.ebi.ac.uk/ols4/ontologies/emap	emap		2026-03-01T05:10:14.670072916
emapa	Mouse Developmental Anatomy Ontology	An ontology for mouse anatomy covering embryonic development and postnatal stages.	http://www.informatics.jax.org/expression.shtml	http://www.informatics.jax.org/expression.shtml	https://www.ebi.ac.uk/ols4/ontologies/emapa	emapa	http://purl.obolibrary.org/obo/emapa/releases/2026-02-11/emapa.owl	2026-03-01T04:41:29.884686116
emi	The Earth Metabolome Initiative (EMI) ontology	The Earth Metabolome Initiative (EMI) ontology is designed to capture and structure the metabolic content of all currently known species on our planet.	https://w3id.org/emi	https://w3id.org/emi	https://www.ebi.ac.uk/ols4/ontologies/emi	emi	https://w3id.org/emi/version/1.0	2026-03-01T05:10:54.135478509
enm	eNanoMapper ontology	The eNanoMapper project (https://www.enanomapper.net/), NanoCommons project (https://www.nanocommons.eu/) and ACEnano project (http://acenano-project.eu/) are creating a pan-European computational infrastructure for toxicological data management for ENMs, based on semantic web standards and ontologies. This ontology is an application ontology targeting the full domain of nanomaterial safety assessment. It re-uses several other ontologies including the NPO, CHEMINF, ChEBI, and ENVO.	http://www.enanomapper.net/	http://www.enanomapper.net/	https://www.ebi.ac.uk/ols4/ontologies/enm	enm	http://enanomapper.github.io/ontologies/releases/10.0/enanomapper.owl	2026-03-01T05:22:00.339235490
ensemblglossary	Ensembl Glossary	The Ensembl glossary lists the terms, data types and file types that are used in Ensembl and describes how they are used.	http://ensembl.org/glossary	http://ensembl.org/glossary	https://www.ebi.ac.uk/ols4/ontologies/ensemblglossary	ensemblglossary	http://ensembl.org/glossary/ensembl-glossary/releases/2023-01-04/ensembl-glossary.owl	2026-03-01T05:17:04.144331388
envo	The Environment Ontology	ENVO is an ontology which represents knowledge about environments,environmental processes, ecosystems, habitats, and related entities	http://environmentontology.org/	http://environmentontology.org/	https://www.ebi.ac.uk/ols4/ontologies/envo	envo	http://purl.obolibrary.org/obo/envo/releases/2025-10-20/envo.owl	2026-03-01T04:41:31.676218917
epio	Epilepsy Ontology (EPIO)	"The Epilepsy Ontology (EPIO) is an assembly of structured knowledge on various aspects of epilepsy, developed according to basic formal ontology (BFO) and Open Biological and Biomedical Ontology (OBO) Foundry principles. Entities and definitions are collected from the latest International League against Epilepsy (ILAE) classification, as well as from domain-specific ontologies such as Epilepsy Ontology (EPILONT), Epilepsy Syndrome Seizure Ontology (ESSO), Epilepsy Semiology(EPISEM) and Epilepsy and Seizure Ontology (EPSO) and scientific literature.

This ontology is intended to be used  for data management and for text mining purposes. The current release of the ontology is publicly available and is a community based effort to assemble various facets of the complex disease Epilepsy."	https://github.com/SCAI-BIO/EpilepsyOntology	https://github.com/SCAI-BIO/EpilepsyOntology	https://www.ebi.ac.uk/ols4/ontologies/epio	epio	https://bio.scai.fraunhofer.de/ontology/epilepsy/2021-05-28/EPIO.owl	2026-03-01T04:41:33.061741786
eupath	VEuPathDB Ontology	The VEuPathDB ontology is an application ontology developed to encode our understanding of what data is about in the public resources developed and maintained by the Eukaryotic Pathogen, Host and Vector Genomics Resource (VEuPathDB; https://veupathdb.org). The VEuPathDB ontology was previously named the EuPathDB ontology prior to EuPathDB joining with VectorBase.The ontology was built based on the Ontology of Biomedical Investigations (OBI) with integration of other OBO ontologies such as PATO, OGMS, DO, etc. as needed for coverage. Currently the VEuPath ontology is primarily intended to be used for support of the VEuPathDB sites. Terms with VEuPathDB ontology IDs that are not specific to VEuPathDB will be submitted to OBO Foundry ontologies for subsequent import and replacement of those terms when they are available.	https://github.com/VEuPathDB-ontology/VEuPathDB-ontology	https://github.com/VEuPathDB-ontology/VEuPathDB-ontology	https://www.ebi.ac.uk/ols4/ontologies/eupath	eupath	http://purl.obolibrary.org/obo/eupath/2023-05-30/eupath.owl	2026-03-01T05:09:15.023311708
evorao	evorao		https://www.ebi.ac.uk/ols4/ontologies/evorao		https://www.ebi.ac.uk/ols4/ontologies/evorao	evorao		2026-03-01T05:10:23.090278887
exmo	EXMO	A core reference ontology built upon BFO about exercise medicine. This ontology contains the related terms for healthy people, people with chronic conditions and people living with diability to exercise.	https://github.com/Exercise-Medicine-Ontology/EXMO	https://github.com/Exercise-Medicine-Ontology/EXMO	https://www.ebi.ac.uk/ols4/ontologies/exmo	exmo	http://purl.obolibrary.org/obo/exmo/2025-06-05/exmo.owl	2026-03-01T04:41:33.504269568
exo	Exposure ontology (ExO)	ExO is intended to bridge the gap between exposure science and diverse environmental health disciplines including toxicology, epidemiology, disease surveillance, and epigenetics.	https://github.com/CTDbase/exposure-ontology	https://github.com/CTDbase/exposure-ontology	https://www.ebi.ac.uk/ols4/ontologies/exo	exo	http://purl.obolibrary.org/obo/exo/releases/2025-08-29/exo.owl	2026-03-01T04:41:33.717606692
fao	Fungal gross anatomy	A structured controlled vocabulary for the anatomy of fungi.	https://github.com/obophenotype/fungal-anatomy-ontology/	https://github.com/obophenotype/fungal-anatomy-ontology/	https://www.ebi.ac.uk/ols4/ontologies/fao	fao	http://purl.obolibrary.org/obo/fao/releases/2025-07-15/fao.owl	2026-03-01T04:41:33.809039748
fbbi	Biological Imaging Methods Ontology	A structured controlled vocabulary of sample preparation, visualization and imaging methods used in biomedical research.	http://cellimagelibrary.org/	http://cellimagelibrary.org/	https://www.ebi.ac.uk/ols4/ontologies/fbbi	fbbi	http://purl.obolibrary.org/obo/fbbi/releases/2026-01-23/fbbi.owl	2026-03-01T05:09:15.879034934
fbbt	Drosophila gross anatomy	An ontology representing the gross anatomy of Drosophila melanogaster.	http://purl.obolibrary.org/obo/fbbt	http://purl.obolibrary.org/obo/fbbt	https://www.ebi.ac.uk/ols4/ontologies/fbbt	fbbt	http://purl.obolibrary.org/obo/fbbt/releases/2026-01-13/fbbt.owl	2026-03-01T04:41:40.272661808
fbcv	FlyBase Controlled Vocabulary	A structured controlled vocabulary used for various aspects of annotation by FlyBase.	http://purl.obolibrary.org/obo/fbcv	http://purl.obolibrary.org/obo/fbcv	https://www.ebi.ac.uk/ols4/ontologies/fbcv	fbcv	http://purl.obolibrary.org/obo/fbcv/releases/2026-01-13/fbcv.owl	2026-03-01T04:41:52.057073144
fbdv	Drosophila development	A structured controlled vocabulary of the development of Drosophila melanogaster.	http://purl.obolibrary.org/obo/fbdv	http://purl.obolibrary.org/obo/fbdv	https://www.ebi.ac.uk/ols4/ontologies/fbdv	fbdv	http://purl.obolibrary.org/obo/fbdv/releases/2026-01-13/fbdv.owl	2026-03-01T04:41:52.585716393
flopo	Flora Phenotype Ontology	Traits and phenotypes of flowering plants occurring in digitized Floras	https://github.com/flora-phenotype-ontology/flopoontology	https://github.com/flora-phenotype-ontology/flopoontology	https://www.ebi.ac.uk/ols4/ontologies/flopo	flopo		2026-03-01T04:41:56.353043887
fma	Foundational Model of Anatomy Ontology (subset)	This is currently a slimmed down version of FMA	http://si.washington.edu/projects/fma	http://si.washington.edu/projects/fma	https://www.ebi.ac.uk/ols4/ontologies/fma	fma	http://purl.org/sig/ont/fma_5.0.0.owl	2026-03-01T05:09:39.868708460
fobi	Food-Biomarker Ontology	FOBI (Food-Biomarker Ontology) is an ontology to represent food intake data and associate it with metabolomic data	https://github.com/pcastellanoescuder/FoodBiomarkerOntology	https://github.com/pcastellanoescuder/FoodBiomarkerOntology	https://www.ebi.ac.uk/ols4/ontologies/fobi	fobi	http://purl.obolibrary.org/obo/fobi/fobi.owl	2026-03-01T04:42:02.392322413
foodon	Food Ontology	A broadly scoped ontology representing entities which bear a “food role”. It encompasses materials in natural ecosystems and agriculture that are consumed by humans and domesticated animals. This includes any generic (unbranded) raw or processed food material found in processing plants, markets, stores or food distribution points. FoodOn also imports nutritional component and dietary pattern terms from other OBO Foundry ontologies to support interoperability in diet and nutrition research	https://foodon.org/	https://foodon.org/	https://www.ebi.ac.uk/ols4/ontologies/foodon	foodon	http://purl.obolibrary.org/obo/foodon/releases/2025-12-30/foodon.owl	2026-03-01T04:42:04.882219182
fovt	FuTRES Ontology of Vertebrate Traits	These are the terms that are improted for FOVT to describe vertebrate traits.	https://github.com/futres/fovt	https://github.com/futres/fovt	https://www.ebi.ac.uk/ols4/ontologies/fovt	fovt	http://purl.obolibrary.org/obo/fovt/releases/2023-05-31/fovt.owl	2026-03-01T04:42:12.948383316
fypo	Fission Yeast Phenotype Ontology (FYPO)	A formal ontology of phenotypes observed in fission yeast.	https://github.com/pombase/fypo	https://github.com/pombase/fypo	https://www.ebi.ac.uk/ols4/ontologies/fypo	fypo	http://purl.obolibrary.org/obo/fypo/releases/2026-02-25/fypo.owl	2026-03-01T04:42:19.282415931
gallont	Plant Gall Ontology	Ontology of plant gall phenotypes. Plant galls are novel plant structures, generated by plants in response to biotic stressors. This ontology is used to annotate gall phenotypes (e.g., their colors, textures, sizes, locations on the plant) in a semantic way, in order to facilitate discoveries about the genetic and physiologic mechanisms responsible for such phenotypes. The ontology can also be used as a controlled vocabulary for natural language descriptions of plant galls.	https://adeans.github.io/gallont/	https://adeans.github.io/gallont/	https://www.ebi.ac.uk/ols4/ontologies/gallont	gallont	http://purl.obolibrary.org/obo/gallont/releases/2024-04-19/gallont.owl	2026-03-01T04:42:23.381688563
gaz	Gazetteer	A gazetteer constructed on ontological principles. The countries are actively maintained.	http://environmentontology.github.io/gaz/	http://environmentontology.github.io/gaz/	https://www.ebi.ac.uk/ols4/ontologies/gaz	gaz		2026-03-01T04:43:43.902404818
gecko	Genomics Cohorts Knowledge Ontology	An ontology to represent genomics cohort attributes.	https://github.com/IHCC-cohorts/GECKO	https://github.com/IHCC-cohorts/GECKO	https://www.ebi.ac.uk/ols4/ontologies/gecko	gecko	http://purl.obolibrary.org/obo/gecko/releases/2021-01-18/gecko.owl	2026-03-01T04:45:22.158375451
genepio	Genomic Epidemiology Ontology	The Genomic Epidemiology Ontology (GenEpiO) covers vocabulary necessary to identify, document and research foodborne pathogens and associated outbreaks.	http://genepio.org/	http://genepio.org/	https://www.ebi.ac.uk/ols4/ontologies/genepio	genepio	http://purl.obolibrary.org/obo/genepio/releases/2024-12-18/genepio.owl	2026-03-01T04:45:22.608081565
geno	GENO ontology	"GENO is an OWL model of genotypes, their more fundamental sequence components, and links to related biological and experimental entities.  At present many parts of the model are exploratory and set to undergo refactoring.  In addition, many classes and properties have GENO URIs but are place holders for classes that will be imported from an external ontology (e.g. SO, ChEBI, OBI, etc).  Furthermore, ongoing work will implement a model of genotype-to-phenotype associations. This will support description of asserted and inferred relationships between a genotypes, phenotypes, and environments, and the evidence/provenance behind these associations. 

Documentation is under development as well, and for now a slidedeck is available at http://www.slideshare.net/mhb120/brush-icbo-2013"	https://github.com/monarch-initiative/GENO-ontology/	https://github.com/monarch-initiative/GENO-ontology/	https://www.ebi.ac.uk/ols4/ontologies/geno	geno	http://purl.obolibrary.org/obo/geno/releases/2026-02-02/geno.owl	2026-03-01T04:45:23.754771712
geo	Geographical Entity Ontology	An ontology of geographical entities	https://github.com/ufbmi/geographical-entity-ontology/wiki	https://github.com/ufbmi/geographical-entity-ontology/wiki	https://www.ebi.ac.uk/ols4/ontologies/geo	geo		2026-03-01T04:45:23.956658472
gexo	Gene Expression Ontology	Gene Expression Ontology	http://www.semantic-systems-biology.org/apo	http://www.semantic-systems-biology.org/apo	https://www.ebi.ac.uk/ols4/ontologies/gexo	gexo		2026-03-01T05:21:35.505090580
gno	Glycan Naming Ontology	An ontology for glycans based on GlyTouCan, but organized by subsumption.	https://gnome.glyomics.org/	https://gnome.glyomics.org/	https://www.ebi.ac.uk/ols4/ontologies/gno	gno	http://purl.obolibrary.org/obo/gno/2025-10-10/gno.owl	2026-03-01T04:45:38.294538404
go	Gene Ontology	The Gene Ontology (GO) provides a framework and set of concepts for describing the functions of gene products from all organisms.	http://geneontology.org/	http://geneontology.org/	https://www.ebi.ac.uk/ols4/ontologies/go	go	http://purl.obolibrary.org/obo/go/releases/2026-01-23/extensions/go-plus.ofn	2026-03-01T04:46:18.700980175
gold	gold		https://www.ebi.ac.uk/ols4/ontologies/gold		https://www.ebi.ac.uk/ols4/ontologies/gold	gold		2026-03-01T05:10:22.633440879
gscmixs	Minimum Information about any (x) Sequence (MIxS) standard	An OWL representation of the Minimum Information for any (x) Standard (MIxS), managed by the Genomic Standards Consortium. This file is released by the Genomic Standards Consortium (GSC; https://www.gensc.org/) for use by anyone handling data or information about biological sequences.	https://w3id.org/mixs	https://w3id.org/mixs	https://www.ebi.ac.uk/ols4/ontologies/gscmixs	gscmixs		2026-03-01T05:27:43.639594179
gsso	GSSO - the Gender, Sex, and Sexual Orientation ontology	GSSO is the Gender, Sex, and Sex Orientation ontology, including terms related to gender identity and expression, sexual and romantic identity and orientation, and sexual and reproductive behavior.	https://gsso.research.cchmc.org/	https://gsso.research.cchmc.org/	https://www.ebi.ac.uk/ols4/ontologies/gsso	gsso	http://purl.obolibrary.org/obo/gsso/releases/2.0.5/gsso.owl	2026-03-01T05:08:39.334276504
hancestro	Human Ancestry Ontology	Human ancestry ontology for the NHGRI GWAS Catalog	https://ebispot.github.io/hancestro/	https://ebispot.github.io/hancestro/	https://www.ebi.ac.uk/ols4/ontologies/hancestro	hancestro	http://purl.obolibrary.org/obo/hancestro/releases/2025-10-14/hancestro.owl	2026-03-01T04:46:41.611861159
hao	Hymenoptera Anatomy Ontology	A structured controlled vocabulary of the anatomy of the Hymenoptera (bees, wasps, and ants)	http://hymao.org	http://hymao.org	https://www.ebi.ac.uk/ols4/ontologies/hao	hao	http://purl.obolibrary.org/obo/hao/2023-06-01/hao.owl	2026-03-01T04:46:42.229889611
hba	Human Brain Atlas Ontology	An application ontology built by combining ontologised versions of the Allen Institute Human Brain Atlas (HBA) Structure Graph mapped to Uberon.	https://purl.brain-bican.org/ontology/hbao	https://purl.brain-bican.org/ontology/hbao	https://www.ebi.ac.uk/ols4/ontologies/hba	hba	https://purl.brain-bican.org/ontology/hbao/releases/2025-02-10/hbao.owl	2026-03-01T05:11:04.824504374
hcao	Human Cell Atlas Ontology	Application ontology for human cell types, anatomy and development stages for the Human Cell Atlas.	https://www.ebi.ac.uk/ols4/ontologies/hcao		https://www.ebi.ac.uk/ols4/ontologies/hcao	hcao	http://ontology.data.humancellatlas.org/ontologies/hcao/releases/2023-05-16/hcao.owl	2026-03-01T05:23:26.232939011
hgnc	HUGO Gene Nomenclature Committee	The HGNC (HUGO Gene Nomenclature Committee) provides an approved gene name and symbol (short-form abbreviation) for each known human gene.  All approved symbols are stored in the HGNC database, and each symbol is unique. HGNC identifiers refer to records in the HGNC symbol database.	http://www.genenames.org	http://www.genenames.org	https://www.ebi.ac.uk/ols4/ontologies/hgnc	hgnc	https://w3id.org/biopragmatics/resources/hgnc/2026-02-06/hgnc.ofn	2026-03-01T05:26:56.785291538
